{
  "$schema": "http://json-schema.org/draft-06/schema#",
  "$id": "https://distanthorizon.dev/schemas/ship_class.schema.json",
  "title": "Ship class document",
  "description": "A hull's multi-deck plan (deck-plan format v3, docs/deckplan-format.md) plus the cargo characteristics M3 trading needs. Derived from the Gleam decoders in server/src/dh_server/shipclass.gleam (ship_class_decoder/cargo_decoder/handling_decoder) and server/src/dh_server/deckplan.gleam (decoder, embedded at the top level via decode.then) — those decoders are the source of truth; this schema is documentation and a typo-catcher, not a substitute for them. additionalProperties is false at every object level even though the decoders themselves ignore unknown fields, precisely so this schema can catch typos the decoders would silently swallow.",
  "type": "object",
  "additionalProperties": false,
  "required": [
    "schema", "id", "name",
    "decks",
    "cargo"
  ],
  "properties": {
    "schema": { "type": "integer" },
    "id": { "type": "string" },
    "name": { "type": "string" },
    "decks": {
      "type": "array",
      "items": { "$ref": "#/$defs/deck" }
    },
    "consoles": {
      "type": "array",
      "description": "Optional. Authored as center glyphs in the grids (h=helm, c=cargo, b=broker, Q=docking port) and derived at load; the server re-emits this list (namespaced, over the wire) but hand-authored docs omit it.",
      "items": { "$ref": "#/$defs/console" }
    },
    "spawn": { "$ref": "#/$defs/spawn" },
    "cargo": {
      "type": "object",
      "additionalProperties": false,
      "required": ["capacity", "handling"],
      "properties": {
        "capacity": {
          "type": "integer",
          "minimum": 0,
          "description": "Hold size in cargo units. Must be >= 0 (enforced by the Gleam decoder's validate step, not by this schema)."
        },
        "handling": {
          "type": "string",
          "enum": ["breakbulk", "container"],
          "description": "How cargo physically gets aboard: break-bulk hulls load by robot stevedores anywhere; container hulls need a station crane and never open their holds."
        }
      }
    },
    "dock_port_orientation": {
      "type": "number",
      "description": "Optional field (decode.optional_field, default 90). This hull's docking-port outward normal in its own frame, in DEGREES (0 = nose/+x). 90 = port flank (side-on mooring, the default). Combined with a station berth's orientation to fix the moored heading (issue #14)."
    },
    "dock_standoff": {
      "type": "number",
      "description": "Optional field (decode.optional_field, default 20.0). How far this hull's centre stands off the berth mooring line, in tiles (= metres), along the berth's outward normal — the per-ship half of the moored sim pose (issue #31). Authored per class since wide hulls stand off further than narrow ones."
    },
    "mass": {
      "type": "number",
      "description": "Optional field (decode.optional_field, default 100.0; server/src/dh_server/hull.gleam). Dry structural mass — total fit mass = this + every fitted module and part (docs/modules.md, M4)."
    },
    "provides": { "$ref": "#/$defs/tags" },
    "requires": { "$ref": "#/$defs/tags" },
    "mounts": {
      "type": "array",
      "description": "Optional field (decode.optional_field, default []). Exterior attach points parts hang on (docs/modules.md, M4).",
      "items": { "$ref": "#/$defs/mount" }
    },
    "slots": {
      "type": "array",
      "description": "Optional field (decode.optional_field, default []). Modulable interior regions (docs/modules.md, M4). A tile joins a slot by carrying that slot's hex digit in its SW corner; everything without a digit is fixed hull structure no module may overwrite.",
      "items": { "$ref": "#/$defs/slot" }
    },
    "default_loadout": {
      "type": "object",
      "description": "Optional field (decode.optional_field). The loadout this hull ships with: slot id -> module id, mount id -> part id.",
      "additionalProperties": false,
      "properties": {
        "modules": {
          "type": "object",
          "additionalProperties": { "type": "string" }
        },
        "parts": {
          "type": "object",
          "additionalProperties": { "type": "string" }
        }
      }
    }
  },
  "$defs": {
    "deck": {
      "type": "object",
      "additionalProperties": false,
      "required": ["name", "grid"],
      "properties": {
        "name": { "type": "string" },
        "grid": {
          "type": "array",
          "description": "3*height rows of 3*width chars: each tile is a 3x3 block. Centre glyph = ' ' floor, '.' void, 'x' stairs, 's' spawn, or a console (h=helm, c=cargo, b=broker, Q=docking port) — consoles/spawn are DERIVED from these glyphs. N/E/S/W edge-mids = ' ' open, '#' wall, '=' door, letter fixture. See docs/deckplan-format.md. Row count and each row's length must be multiples of 3 and consistent (enforced by the Gleam decoder, not by this schema).",
          "items": { "type": "string" }
        }
      }
    },
    "console": {
      "type": "object",
      "additionalProperties": false,
      "required": ["id", "kind", "x", "y"],
      "properties": {
        "id": { "type": "string" },
        "kind": {
          "type": "string",
          "description": "Free-form in the decoder (e.g. \"helm\"/\"cargo\" are conventions, not constraints); left open here. At least one console of kind \"helm\" is required by the Gleam decoder's validate step, not by this schema."
        },
        "deck": {
          "type": "integer",
          "description": "Which deck index this console sits on (default 0)."
        },
        "x": { "type": "integer" },
        "y": { "type": "integer" }
      }
    },
    "spawn": {
      "type": "object",
      "additionalProperties": false,
      "required": ["tile"],
      "properties": {
        "deck": {
          "type": "integer",
          "description": "Which deck arriving characters appear on (default 0)."
        },
        "tile": {
          "type": "array",
          "description": "[x, y] tile where arriving characters appear (the airlock/gangway end).",
          "items": { "type": "integer" },
          "minItems": 2,
          "maxItems": 2
        }
      }
    },
    "tags": {
      "type": "object",
      "description": "A {tag: amount} object. Tags are open strings the engine only compares and sums (server/src/dh_server/hull.gleam tags_decoder).",
      "additionalProperties": { "type": "integer" }
    },
    "slot": {
      "type": "object",
      "additionalProperties": false,
      "required": ["digit", "id", "name"],
      "properties": {
        "digit": {
          "type": "integer",
          "minimum": 0,
          "maximum": 15,
          "description": "The hex digit hull tiles carry in their SW corner to join this slot (range enforced by the Gleam decoder's validate step too)."
        },
        "id": {
          "type": "string",
          "description": "What a module names in its own \"slot\" field."
        },
        "name": { "type": "string" }
      }
    },
    "mount": {
      "type": "object",
      "additionalProperties": false,
      "required": ["id", "kind", "size"],
      "properties": {
        "id": { "type": "string" },
        "kind": {
          "type": "string",
          "description": "What sort of part takes this mount — \"engine\" for now."
        },
        "size": {
          "type": "string",
          "enum": ["s", "m", "l"],
          "description": "A mount takes any part of its kind up to this size."
        }
      }
    }
  }
}
