{
  "schema": 3,
  "id": "goldfinch",
  "name": "Goldfinch",
  "decks": [
    {
      "name": "Upper",
      "grid": [
        "               ",
        " .  .  .  .  . ",
        "               ",
        "   #########   ",
        " . #       # . ",
        "   1# 1  1#    ",
        "      # #      ",
        " .  . # # .  . ",
        "      # #      ",
        "   ###   ###   ",
        " . #       # . ",
        "   2     3     ",
        "               ",
        " . #       # . ",
        "   2     3     ",
        "               ",
        " . #       # . ",
        "   4     5     ",
        "               ",
        " . #       # . ",
        "   4     5     ",
        "               ",
        " . #       # . ",
        "   6     7     ",
        "               ",
        " . #       # . ",
        "   6     7     ",
        "               ",
        " . #       # . ",
        "               ",
        "               ",
        " . #       # . ",
        "               ",
        "          #    ",
        " . #      x# . ",
        "          #    ",
        "               ",
        " . #       # . ",
        "   #########   ",
        "               ",
        " .  .  .  .  . ",
        "               "
      ]
    },
    {
      "name": "Mezzanine",
      "grid": [
        "               ",
        " .  .  .  .  . ",
        "               ",
        "               ",
        " .  .  .  .  . ",
        "               ",
        "               ",
        " .  .  .  .  . ",
        "               ",
        "               ",
        " .  .  .  .  . ",
        "               ",
        "               ",
        " .  .  .  .  . ",
        "               ",
        "               ",
        " .  .  .  .  . ",
        "               ",
        "               ",
        " .  .  .  .  . ",
        "               ",
        "               ",
        " .  .  .  .  . ",
        "               ",
        "               ",
        " .  .  .  .  . ",
        "               ",
        "   #########   ",
        " . =q=   =q= . ",
        "   #### ####   ",
        "   #### #      ",
        " . #x   # .  . ",
        "   #### #      ",
        "      # ####   ",
        " .  . #   x# . ",
        "      ######   ",
        "               ",
        " .  .  .  .  . ",
        "               ",
        "               ",
        " .  .  .  .  . ",
        "               "
      ]
    },
    {
      "name": "Lower",
      "grid": [
        "               ",
        " .  .  .  .  . ",
        "               ",
        "   #########   ",
        " . #       # . ",
        "   e  e  e     ",
        "               ",
        " . #       # . ",
        "   e  e  e     ",
        "               ",
        " . #       # . ",
        "   8     9     ",
        "               ",
        " . #       # . ",
        "   8     9     ",
        "               ",
        " . #       # . ",
        "   a     b     ",
        "               ",
        " . #       # . ",
        "   a     b     ",
        "               ",
        " . #       # . ",
        "   c     d     ",
        "               ",
        " . #       # . ",
        "   c     d     ",
        "               ",
        " . #       # . ",
        "               ",
        "               ",
        " . #x      # . ",
        "               ",
        "               ",
        " . #       # . ",
        "   f  f  f     ",
        "               ",
        " . #       # . ",
        "   f##f##f##   ",
        "               ",
        " .  .  .  .  . ",
        "               "
      ]
    }
  ],
  "mass": 90.0,
  "provides": { "power": 34 },
  "requires": { "engine": 1 },
  "mounts": [
    { "id": "engine_port",   "kind": "engine", "size": "s" },
    { "id": "engine_center", "kind": "engine", "size": "m" },
    { "id": "engine_stbd",   "kind": "engine", "size": "s" }
  ],
  "slots": [
    { "digit": 1,  "id": "cockpit",     "name": "Cockpit" },
    { "digit": 2,  "id": "cabin_u_p_a", "name": "Upper cabin A, port" },
    { "digit": 3,  "id": "cabin_u_s_a", "name": "Upper cabin A, starboard" },
    { "digit": 4,  "id": "cabin_u_p_b", "name": "Upper cabin B, port" },
    { "digit": 5,  "id": "cabin_u_s_b", "name": "Upper cabin B, starboard" },
    { "digit": 6,  "id": "cabin_u_p_c", "name": "Upper cabin C, port" },
    { "digit": 7,  "id": "cabin_u_s_c", "name": "Upper cabin C, starboard" },
    { "digit": 8,  "id": "cabin_l_p_a", "name": "Lower cabin A, port" },
    { "digit": 9,  "id": "cabin_l_s_a", "name": "Lower cabin A, starboard" },
    { "digit": 10, "id": "cabin_l_p_b", "name": "Lower cabin B, port" },
    { "digit": 11, "id": "cabin_l_s_b", "name": "Lower cabin B, starboard" },
    { "digit": 12, "id": "cabin_l_p_c", "name": "Lower cabin C, port" },
    { "digit": 13, "id": "cabin_l_s_c", "name": "Lower cabin C, starboard" },
    { "digit": 14, "id": "galley",      "name": "Galley" },
    { "digit": 15, "id": "hold",        "name": "Main hold" }
  ],
  "default_loadout": {
    "modules": {
      "cockpit":     "rijay.cockpit.duo_3x1",
      "cabin_u_p_a": "rijay.cabin.standard",
      "cabin_u_s_a": "rijay.cabin.standard",
      "cabin_u_p_b": "rijay.cabin.standard",
      "cabin_u_s_b": "rijay.cabin.standard",
      "cabin_u_p_c": "rijay.cabin.standard",
      "cabin_u_s_c": "rijay.cabin.standard",
      "cabin_l_p_a": "rijay.cabin.standard",
      "cabin_l_s_a": "rijay.cabin.standard",
      "cabin_l_p_b": "rijay.cabin.standard",
      "cabin_l_s_b": "rijay.cabin.standard",
      "cabin_l_p_c": "rijay.cabin.standard",
      "cabin_l_s_c": "rijay.cabin.standard",
      "galley":      "rijay.galley.standard",
      "hold":        "rijay.hold.breakbulk_3x2"
    },
    "parts": {
      "engine_center": "rijay.engine.stork_240c2",
      "engine_port":   "rijay.engine.wren_90b",
      "engine_stbd":   "rijay.engine.wren_90b"
    }
  },
  "cargo": {
    "capacity": 2,
    "handling": "breakbulk"
  },
  "dock_port_orientation": 90.0,
  "dock_standoff": 16.0
}
