{
  "schema": 3,
  "id": "test_fixture",
  "name": "Harness Test Fixture",
  "decks": [
    {
      "name": "Main",
      "grid": [
        "                              ",
        " .  .  .  .  .  .  .  .  .  . ",
        "                              ",
        "   ################c#######   ",
        " . #                      # . ",
        "   #                      #   ",
        "   #                      #   ",
        " . h                      # . ",
        "   #        1             #   ",
        "   #                      #   ",
        " . =Q                     # . ",
        "   #                      #   ",
        "   #                      #   ",
        " . #                      # . ",
        "   ########################   ",
        "                              ",
        " .  .  .  .  .  .  .  .  .  . ",
        "                              "
      ]
    }
  ],
  "mass": 120.0,
  "provides": { "power": 10 },
  "requires": { "engine": 1 },
  "slots": [ { "digit": 1, "id": "bay", "name": "Bay" } ],
  "mounts": [ { "id": "engine_center", "kind": "engine", "size": "m" } ],
  "default_loadout": { "parts": { "engine_center": "consol.engine.co17f_2" } },
  "cargo": {
    "capacity": 40,
    "handling": "breakbulk"
  },
  "dock_port_orientation": 90.0,
  "dock_standoff": 12.0
}
